Latitude,Longitude,Pin Type,id,Name,Size,City,Country,Zip/Postal Code
28.6934076, -81.53221489999999, familyPin, 2828, The Little Garden That Could, large_over_20x20, Kingston, AL, 18704
28.676111, -81.51055600000001, communityPin, 2829, Smarts Farm, planter_box_etc, San Diego, CA, 92101
6.5243793, 3.379205700000057, familyPin, 2830, Dubbs Greenland, medium_20x20, Columbia, SC, 29212
6.5243793, 3.379205700000057, familyPin, 2831, Feather and Scale Farm, medium_20x20, Westbrook, ME, 04092
6.5243793, 3.379205700000057, friendPin, 2832, one, medium_20x20, westbury, NY, 11001
6.5243793, 3.379205700000057, friendPin, 2833, Pemberley, small_10x10, Dallas, TX, 75206
28.6934076, -81.53221489999999, familyPin, 2834, Ecomommas Paradise, large_over_20x20, Winnipeg, MB, 
6.5243793, 3.379205700000057, familyPin, 2835, 3rd Acre Farm, large_over_20x20, Scottsdale, AZ, 85250
6.5243793, 3.379205700000057, familyPin, 2836, Sonias Garden, medium_20x20, Naples, FL, 34112
6.5243793, 3.379205700000057, friendPin, 2837, Henpecked Garden, large_over_20x20, Raleigh, NC, 27609
6.5243793, 3.379205700000057, familyPin, 2838, Green Gone Crazy, medium_20x20, Cairns, QL, 
6.5243793, 3.379205700000057, communityPin, 2839, Bungalow Community Garden, large_over_20x20, Cairns, QL, 
41.153332, 20.168330999999966, familyPin, 2840, The Thielen-Trnka Gardens, medium_20x20, Minneapolis, MN, 55406
18.2013463, -67.14515169999999, friendPin, 2841, Covewinds Farm, large_over_20x20, Port Charlotte, FL, 33981
41.153332, 20.168330999999966, familyPin, 2842, amor y paz, medium_20x20, Rochester, MN, 55901
55.7113112, 9.53635410000004, familyPin, 2843, Family garden, planter_box_etc, Blacklick, OH, 43004
41.153332, 20.168330999999966, familyPin, 2844, my office, medium_20x20, denton, La, 
18.2013463, -67.14515169999999, familyPin, 2845, gartenkindgruen, large_over_20x20, Prangendorf, ME, 
26.4740655, 80.34687570000006, familyPin, 2846, kennard, large_over_20x20, saint paul, MN, 55106
18.2013463, -67.14515169999999, friendPin, 2847, Home, small_10x10, Merida, Yu, 
18.2013463, -67.14515169999999, familyPin, 2848, Lutz Family Garden, medium_20x20, Louisville, CO, 80027
18.2013463, -67.14515169999999, familyPin, 2849, greenlali, planter_box_etc, Cudahy, CA, 90201
18.2013463, -67.14515169999999, friendPin, 2850, ArunodayGarden, planter_box_etc, Gurgaon, Ha, 
18.2013463, -67.14515169999999, familyPin, 2851, Zin Place, medium_20x20, Sedalia, MO, 65301
18.2013463, -67.14515169999999, friendPin, 2852, The Garden of life, small_10x10, Detroit, MI, 48206
18.2013463, -67.14515169999999, friendPin, 2853, Garden, small_10x10, Detroit, MI, 48209
18.2013463, -67.14515169999999, friendPin, 2854, Joeys Apartment Garden, planter_box_etc, West Hollywood, CA, 90069
18.2013463, -67.14515169999999, familyPin, 2855, Garden 1, planter_box_etc, Detroit, MI, 48224
18.2013463, -67.14515169999999, familyPin, 2856, JP, small_10x10, Detroit, MI, 48224
41.153332, 20.168330999999966, familyPin, 2857, Garden, small_10x10, Detroit, MI, 48206
41.153332, 20.168330999999966, familyPin, 2858, garden, small_10x10, Detroit, MI, 48204
41.153332, 20.168330999999966, familyPin, 2859, caham, medium_20x20, Detroit, MI, 48212
33.6593172, -87.02263670000002, familyPin, 2860, Mother love, large_over_20x20, Detroit, MI, 48228
37.6089001, -122.03613849999999, familyPin, 2861, home, small_10x10, Detroit, MI, 48206
33.6593172, -87.02263670000002, familyPin, 2862, Garden, medium_20x20, Detroit, MI, 48202
33.6593172, -87.02263670000002, friendPin, 2863, garden, planter_box_etc, Detroit, MI, 48295
41.153332, 20.168330999999966, friendPin, 2864, vikkis garden, small_10x10, Detroit, MI, 48202
33.6593172, -87.02263670000002, familyPin, 2865, Garden, small_10x10, Detroit, MI, 48224
33.6593172, -87.02263670000002, familyPin, 2866, Garden, large_over_20x20, Detroit, MI, 48206
33.6593172, -87.02263670000002, familyPin, 2867, Happy Days, large_over_20x20, Detroit, MI, 48204
42.388786, -83.1918, friendPin, 2868, Green, large_over_20x20, Detroit, MI, 48227
40.952695, -90.12141, familyPin, 2869, Smiling Frog Farm, farm, Dahinda, IL, 61428
42.6064095, -83.1497751, familyPin, 2870, Good Fuel Galore, planter_box_etc, Los Angeles, CA, 90066
42.6064095, -83.1497751, familyPin, 2871, Kirkland Organic Herb & Vegetable Farm., large_over_20x20, Gadsden, AL, 35903
42.6064095, -83.1497751, familyPin, 2872, garden, medium_20x20, Detroit, MI, 48204
42.6064095, -83.1497751, familyPin, 2873, free, small_10x10, Westland, MI, 48185
42.6064095, -83.1497751, familyPin, 2874, Garden, small_10x10, Detroit, MI, 48206
42.6064095, -83.1497751, familyPin, 2875, Garden, large_over_20x20, Southfield, MI, 48033
42.6064095, -83.1497751, familyPin, 2876, Robins Garden, small_10x10, Detroit, MI, 48224
42.6064095, -83.1497751, familyPin, 2877, Wyss Farm, medium_20x20, Madison Heights, MI, 48071
42.6064095, -83.1497751, friendPin, 2878, Randys Garden, planter_box_etc, Cincinnati, OH, 45214
42.6064095, -83.1497751, familyPin, 2879, Buttercup Farm, medium_20x20, Kingston, NY, 12401
42.6064095, -83.1497751, friendPin, 2880, garden, small_10x10, Detroit, MI, 48202
42.331427, -83.0457538, familyPin, 2881, Lathan, small_10x10, Westland, MI, 48186
42.427636, -83.19547, familyPin, 2882, Garden, small_10x10, Detroit, MI, 48235
42.426786, -83.14969, friendPin, 2883, Myras Garden, small_10x10, Detroit, MI, 48221
42.331427, -83.0457538, familyPin, 2884, Garden, medium_20x20, Detroit, MI, 48219
42.331427, -83.0457538, familyPin, 2885, Brown Family, medium_20x20, Detroit, MI, 48227
42.331427, -83.0457538, familyPin, 2886, Sowing Love, small_10x10, Centreville, VA, 20120
42.331427, -83.0457538, familyPin, 2887, Garden, planter_box_etc, Detroit, AL, 48208
42.331427, -83.0457538, familyPin, 2888, Prosperity, small_10x10, Detroit, AL, 48224
42.355437, -83.21722, familyPin, 2889, America, small_10x10, Detroit, MI, 48228
42.331427, -83.0457538, friendPin, 2890, Garden, planter_box_etc, Detroit, MI, 48238
42.331427, -83.0457538, familyPin, 2891, 40, planter_box_etc, Detroit, MI, 48206
42.348937, -83.08994, familyPin, 2892, Family Harvest, medium_20x20, Detroit, MI, 48208
42.421936, -83.09981, familyPin, 2893, The Love Garden, large_over_20x20, Highland Park, MI, 48203
42.331427, -83.0457538, familyPin, 2894, Garden, small_10x10, Detroit, MI, 48238
42.331427, -83.0457538, familyPin, 2895, Garden, large_over_20x20, Detroit, MI, 48223
42.375787, -83.10849, familyPin, 2896, Angel, small_10x10, Detroit, MI, 48206
42.426786, -83.14969, familyPin, 2897, Love, small_10x10, Detroit, MI, 48221
42.331427, -83.0457538, familyPin, 2898, love, small_10x10, Detroit, MI, 48202
42.331427, -83.0457538, familyPin, 2899, Neicey, planter_box_etc, Detroit, MI, 48204
42.331427, -83.0457538, familyPin, 2900, espie, small_10x10, Detroit, MI, 48238
42.331427, -83.0457538, familyPin, 2901, cashmere, small_10x10, Detroit, MI, 48224
42.331427, -83.0457538, familyPin, 2902, Garden, medium_20x20, Detroit, MI, 48202
42.331427, -83.0457538, familyPin, 2903, Blessed, small_10x10, Detroit, MI, 48219
42.331427, -83.0457538, friendPin, 2904, Yes, small_10x10, Detroit, MI, 48238
42.331427, -83.0457538, familyPin, 2905, Jenkins, medium_20x20, Detroit, MI, 48228
42.331427, -83.0457538, communityPin, 2906, Slataper Street Garden, farm, Fort Wayne, IN, 46803
42.331427, -83.0457538, familyPin, 2907, mo media, medium_20x20, Detroit, MI, 48204
42.331427, -83.0457538, friendPin, 2908, garden, medium_20x20, Detroit, MI, 48239
42.331427, -83.0457538, familyPin, 2909, Walker Garden, medium_20x20, Detroit, MI, 48235
42.331427, -83.0457538, familyPin, 2910, Costa Mesa Community Garden - Hamilton, medium_20x20, Costa Mesa, CA, 92626
42.269288, -83.13676, friendPin, 2911, Jennasis, planter_box_etc, River Rouge, MI, 48218
42.331427, -83.0457538, familyPin, 2912, Love, medium_20x20, Detroit, MI, 48206
42.331427, -83.0457538, familyPin, 2913, Garden, medium_20x20, Detroit, MI, 48224
42.426786, -83.14969, familyPin, 2914, Jordan, small_10x10, Detroit, MI, 48221
42.410487, -82.94348, familyPin, 2915, Howard, small_10x10, Detroit, MI, 48224
42.365337, -83.14254, familyPin, 2916, Eden, small_10x10, Detroit, MI, 48204
42.331427, -83.0457538, familyPin, 2917, Garden, planter_box_etc, Detroit, MI, 48228
42.375237, -83.07837, familyPin, 2918, x, medium_20x20, Detroit, AL, 48202
42.375787, -83.10849, friendPin, 2919, Garden, planter_box_etc, Detroit, MI, 48206
36.837421, -107.96667, communityPin, 2920, SAMARITAN VILLAGE COMMUNITY, large_over_20x20, AZTEC, NM, 87410
42.331427, -83.0457538, familyPin, 2921, Iris Oasis, planter_box_etc, rock hill, SC, 29730
42.331427, -83.0457538, familyPin, 2922, McDonald-Oliver Street Garden, medium_20x20, Westland, MI, 48186
42.331427, -83.0457538, familyPin, 2923, daves garden, medium_20x20, sarasota, FL, 34234
42.331427, -83.0457538, familyPin, 2924, Bolton Family, small_10x10, Detroit, MI, 48234
42.432686, -83.04422, familyPin, 2925, Bolton Family, small_10x10, Detroit, MI, 48234
42.331427, -83.0457538, familyPin, 2926, Projectgrow, large_over_20x20, Ann Arbor, MI, 48103
42.331427, -83.0457538, familyPin, 2927, Home Grown Living, planter_box_etc, Detroit, MI, 48221
42.331427, -83.0457538, familyPin, 2928, Ettas Garden, small_10x10, Ypsilanti, MI, 48197
42.432686, -83.04422, familyPin, 2929, Tyus Family, small_10x10, Detroit, MI, 48234
42.432686, -83.04422, familyPin, 2930, Als Garden, small_10x10, Detroit, MI, 48234
42.432686, -83.04422, familyPin, 2931, rosa, medium_20x20, Detroit, MI, 48234
42.395904, -82.99632, familyPin, 2932, Conway Garden, small_10x10, Detroit, MI, 48213
42.396736, -83.14152, familyPin, 2933, Veggies For Life, small_10x10, Detroit, MI, 48238
42.232807, -83.72671, familyPin, 2934, Oliver, small_10x10, Ann Arbor, MI, 48108
42.368137, -82.99314, familyPin, 2935, ;fourbabies&, planter_box_etc, detroit, AL, 48214
42.432686, -83.04422, familyPin, 2936, rosa, medium_20x20, detroit, MI, 48234
42.524134, -83.25454, familyPin, 2937, Williams family garden, small_10x10, Beverly Hills, MI, 48025
-37.5794919, 144.72889810000004, familyPin, 2938, my garden goodies, small_10x10, sterling heights, MI, 48312
-37.5794919, 144.72889810000004, familyPin, 2939, My backyard garden!, planter_box_etc, Ferndale, MI, 48220
42.670932, -82.77754, familyPin, 2940, the williams garden, planter_box_etc, chesterfield, MI, 48047
42.459022, -83.09819, friendPin, 2941, Pumpkin, medium_20x20, Hazel park, MI, 48030
-37.5794919, 144.72889810000004, familyPin, 2942, horatio, large_over_20x20, detroit, MI, 48209
42.670932, -82.77754, familyPin, 2943, the williams garden, planter_box_etc, chesterfield, MI, 48047
-37.5794919, 144.72889810000004, familyPin, 2944, Bryant family garden, medium_20x20, Detroit, MI, 48221
42.466086, -82.94641, familyPin, 2945, Peter Cottontails Garden of Wonder, small_10x10, Eastpointe, MI, 48021
42.465886, -83.056, communityPin, 2946, Nichols School Garden of Love, medium_20x20, Detroit, MI, 48091
-37.5794919, 144.72889810000004, familyPin, 2947, stress releaver, medium_20x20, hazel park, MI, 48030
-37.5794919, 144.72889810000004, familyPin, 2948, Blessed Garden, medium_20x20, Yazoo City, MS, 39194
-37.5794919, 144.72889810000004, familyPin, 2949, On the Porch, planter_box_etc, Detroit, MI, 48221
-37.5794919, 144.72889810000004, familyPin, 2950, Red & Sues World, large_over_20x20, Warren, MI, 48091
-37.5794919, 144.72889810000004, communityPin, 2951, ERA Helping Hands Garden, small_10x10, Hamtramck, MI, 48212
-37.5794919, 144.72889810000004, communityPin, 2952, Nichols Elementary Garden, medium_20x20, Detroit, MI, 48214
-37.5794919, 144.72889810000004, familyPin, 2953, Nichol Garden of Love, medium_20x20, Detroit, MI, 48214
10.8230989, 106.6296638, communityPin, 2954, Nichols Elementary Garden, medium_20x20, Detroit, MI, 48214
-37.5794919, 144.72889810000004, familyPin, 2955, O. Green, medium_20x20, Detroit, MI, 48212
-37.5794919, 144.72889810000004, friendPin, 2956, The Browns, small_10x10, Detroit, MI, 48208
42.426285, -83.30197, friendPin, 2957, L Parrish, small_10x10, Redford, MI, 48240
10.8230989, 106.6296638, communityPin, 2958, Hip Hop Garden, large_over_20x20, Detroit, MI, 48203
42.433703, -82.98068, familyPin, 2959, Dillard Garden, small_10x10, Detroit, MI, 48205
-37.5794919, 144.72889810000004, familyPin, 2960, Gods Garden, large_over_20x20, Detroit, MI, 48219
54.77525, -1.5848519999999553, familyPin, 2961, Healthy Living, small_10x10, Detroit, MI, 48208
54.77525, -1.5848519999999553, familyPin, 2962, Grannies Garden, large_over_20x20, Detroit, MI, 48210
10.8230989, 106.6296638, familyPin, 2963, Grannies Garden, large_over_20x20, Detroit, MI, 48210
-37.5794919, 144.72889810000004, familyPin, 2964, Grannies Garden, large_over_20x20, Detroit, MI, 48210
-37.5794919, 144.72889810000004, communityPin, 2965, Redemeption Mile, medium_20x20, Detroit, MI, 48206
-37.5794919, 144.72889810000004, communityPin, 2966, Bond Community, large_over_20x20, Detroit, MI, 48238
-37.5794919, 144.72889810000004, familyPin, 2967, Kathleen Garden, small_10x10, Detroit, MI, 48205
-37.5794919, 144.72889810000004, friendPin, 2968, Steves Place, small_10x10, Allen Parrk, MI, 48101
-37.5794919, 144.72889810000004, friendPin, 2969, Albinas garden, small_10x10, Detroit, MI, 48209
-37.5794919, 144.72889810000004, friendPin, 2970, C Harris, small_10x10, Oak Park, MI, 48237
-37.5794919, 144.72889810000004, familyPin, 2971, Dees Garden, large_over_20x20, Detroit, MI, 48221
-37.5794919, 144.72889810000004, communityPin, 2972, McDuffie, large_over_20x20, Detroit, MI, 48208
-37.5794919, 144.72889810000004, familyPin, 2973, McLean Plot, large_over_20x20, Detroit, MI, 48219
-37.5794919, 144.72889810000004, friendPin, 2974, Byrds Garden, small_10x10, Detroit, AL, 48204
-37.5794919, 144.72889810000004, familyPin, 2975, Grier, small_10x10, Detroit, MI, 48238
10.8230989, 106.6296638, friendPin, 2976, Moon Child, planter_box_etc, Detroit, MI, 48215
54.77525, -1.5848519999999553, communityPin, 2977, Sturtevant Community, large_over_20x20, Detroit, MI, 48216
42.388786, -83.1918, familyPin, 2978, Carr garden, medium_20x20, Detroit, MI, 48227
40.6300567, -79.9703318, friendPin, 2979, Price Family, medium_20x20, Detroit, MI, 48235
10.8230989, 106.6296638, familyPin, 2980, Mellos, small_10x10, Detroit, MI, 48235
10.8230989, 106.6296638, friendPin, 2981, Lovely Garden, small_10x10, Detroit, MI, 48213
10.8230989, 106.6296638, friendPin, 2982, Lovely Garden, small_10x10, Detroit, AL, 48213
10.8230989, 106.6296638, friendPin, 2983, RR Gardens, small_10x10, Detroit, MI, 48206
10.8230989, 106.6296638, familyPin, 2984, Tinas Terrace, small_10x10, Waterford, MI, 48328
10.8230989, 106.6296638, friendPin, 2985, D Skipper, small_10x10, Detroit, MI, 48206
10.8184631, 106.65882450000004, friendPin, 2986, Rogers, medium_20x20, Detroit, MI, 48206
10.8184631, 106.65882450000004, friendPin, 2987, Gaulden, small_10x10, Detroit, MI, 48208
54.77525, -1.5848519999999553, friendPin, 2988, Gaulden, small_10x10, Detroit, AL, 48208
10.8184631, 106.65882450000004, friendPin, 2989, Delks, planter_box_etc, detroit, MI, 48221
10.8184631, 106.65882450000004, friendPin, 2990, Jeffery pepper garden, small_10x10, Detroit, MI, 48204
54.77525, -1.5848519999999553, friendPin, 2991, Wellbeing Garden, small_10x10, Detroit, MI, 48227
54.77525, -1.5848519999999553, familyPin, 2992, Montys, small_10x10, Detroit, MI, 48204
54.77525, -1.5848519999999553, familyPin, 2993, happy garden, small_10x10, Inkster, MI, 48141
54.77525, -1.5848519999999553, friendPin, 2994, Marias, small_10x10, dearborn hts, MI, 48125
54.77525, -1.5848519999999553, friendPin, 2995, Marias, small_10x10, dearborn hts, AL, 48125
40.6300567, -79.9703318, friendPin, 2996, Murray, small_10x10, Detroit, MI, 48210
40.6300567, -79.9703318, friendPin, 2997, Murray, small_10x10, Detroit, AL, 48210
40.6300567, -79.9703318, friendPin, 2998, Murray, small_10x10, Detroit, AL, 48210
40.6300567, -79.9703318, friendPin, 2999, C3, small_10x10, Detroit, MI, 48207
13.7563309, 100.50176510000006, friendPin, 3000, C3, small_10x10, Detroit, AL, 48207
40.6300567, -79.9703318, friendPin, 3001, C3, small_10x10, Detroit, AL, 48207
48.4284207, -123.36564440000001, friendPin, 3002, Serenity, small_10x10, Detroit, MI, 48238
59.9138688, 10.752245399999993, friendPin, 3003, Serenity, small_10x10, Detroit, MI, 48238
48.4284207, -123.36564440000001, familyPin, 3004, The Micro Farm Project, medium_20x20, Phoenix, AZ, 85032
59.9138688, 10.752245399999993, familyPin, 3005, The Micro Farm Project, medium_20x20, Phoenix, AZ, 85032
59.9138688, 10.752245399999993, familyPin, 3006, Greens all natural farm, large_over_20x20, Beavercreek, OH, 45434
59.9138688, 10.752245399999993, communityPin, 3007, Mathis Community Center Garden, large_over_20x20, Detroit, MI, 48235
41.3172032, 19.491944200000034, communityPin, 3008, Eetbaar Heemskerk, large_over_20x20, Heemskerk, , 
45.5086699, -73.55399249999999, friendPin, 3009, Margaurite M., large_over_20x20, Detroit, MI, 48238
45.5086699, -73.55399249999999, familyPin, 3010, Gods Gift to the People, medium_20x20, Detroit, MI, 48235
41.3172032, 19.491944200000034, friendPin, 3011, J.D.s Garden, small_10x10, Detroit, AL, 48204
19.0412967, -98.20619959999999, familyPin, 3012, Eds, large_over_20x20, Loyall, KY, 40854
41.3172032, 19.491944200000034, familyPin, 3013, Eds, large_over_20x20, Loyall, KY, 40854
51.1278758, 1.3134026999999833, familyPin, 3014, Eds, large_over_20x20, Loyall, KY, 40854
45.5086699, -73.55399249999999, familyPin, 3015, Eds, large_over_20x20, Loyall, KY, 40854
-6.3888772, 106.83006869999997, familyPin, 3016, Eds Garden, large_over_20x20, Loyall, KY, 40854
41.3172032, 19.491944200000034, communityPin, 3017, Liquid Sun Community Garden, large_over_20x20, Warren, MI, 48091
45.5016889, -73.56725599999999, friendPin, 3018, steves place, small_10x10, allen park, MI, 48101
42.1758818, 20.603852599999982, familyPin, 3019, Robbins, small_10x10, Redford, MI, 48239
51.1278758, 1.3134026999999833, familyPin, 3020, J.Ns Garden, small_10x10, Detroit, MI, 48227
45.5016889, -73.56725599999999, communityPin, 3021, the secret garden, large_over_20x20, Detroit, MI, 48223
51.1278758, 1.3134026999999833, familyPin, 3022, Hawks Urban Farm, large_over_20x20, Fort Wayne, IN, 46808
19.0412967, -98.20619959999999, familyPin, 3023, veggies and herbs, medium_20x20, Neenah, WI, 54956
51.1278758, 1.3134026999999833, familyPin, 3024, resurrection garden, small_10x10, New Orleans, LA, 70115
51.1278758, 1.3134026999999833, familyPin, 3025, Teeter Farm, large_over_20x20, Kent, WA, 98031
54.6380366, 25.286558300000024, familyPin, 3026, banco de la tierra, medium_20x20, santiago, sa, 
54.6380366, 25.286558300000024, familyPin, 3027, community, medium_20x20, Sheridan, IN, 46069
54.6871555, 25.279651400000034, familyPin, 3028, The Briar Patch, medium_20x20, Mentone - CA, CA, 92359
8.537981, -80.782127, familyPin, 3029, Grand Gardens, small_10x10, Hastings, MI, 49058
8.537981, -80.782127, friendPin, 3030, The Vertical Garden, small_10x10, Murfreesboro, TN, 37129
8.537981, -80.782127, friendPin, 3031, Front Yard Square Foots, small_10x10, Knoxville, TN, 37914
8.537981, -80.782127, familyPin, 3032, HF Starndlyst, farm, 2300 Copenhagen, Co, 
8.537981, -80.782127, corporationPin, 3033, New Garden City - LLC, farm, Washington DC, DC, 20020
54.6380366, 25.286558300000024, familyPin, 3034, Adler Family Gardens, medium_20x20, Hortonville, WI, 54944
8.537981, -80.782127, friendPin, 3035, Backyard Bounty, medium_20x20, San Jose, CA, 95112
8.537981, -80.782127, friendPin, 3036, Hooper Vineyard, medium_20x20, Detroit, MI, 48227
54.6380366, 25.286558300000024, friendPin, 3037, Joy, small_10x10, Detroit, MI, 48227
8.537981, -80.782127, familyPin, 3038, Guzman, small_10x10, Melvendale, MI, 48122
48.6883499, -123.60308889999999, familyPin, 3039, Little green places, planter_box_etc, Brooklyn, NY, 11218
48.6883499, -123.60308889999999, familyPin, 3040, Sunnys, small_10x10, Detroit, MI, 48227
48.6883499, -123.60308889999999, friendPin, 3041, garden, planter_box_etc, Detroit, MI, 48206
39.1031182, -84.51201960000003, familyPin, 3042, Little Planet Earth, large_over_20x20, Rockford, IL, 61104
39.1031182, -84.51201960000003, familyPin, 3043, Beautiful, small_10x10, Detroit, MI, 48206
38.667004, -9.05502619999993, familyPin, 3044, our inca garden, large_over_20x20, Gloucester, MA, 01930
38.667004, -9.05502619999993, familyPin, 3045, Raggedy Hen Farm, large_over_20x20, Eugene, OR, 97402
38.667004, -9.05502619999993, familyPin, 3046, Little Planet Earth, large_over_20x20, Rockford, IL, 61104
49.1044302, -122.80109400000003, familyPin, 3047, Little Planet Earth, large_over_20x20, Rockford, IL, 61104
49.2057179, -122.910956, familyPin, 3048, personal Tower Garden, planter_box_etc, Austin, TX, 78750
49.1044302, -122.80109400000003, familyPin, 3049, Fitzsimmons, planter_box_etc, Brambleton, VA, 20148
49.1044302, -122.80109400000003, friendPin, 3050, Cindys Vertical Garden, small_10x10, Ridgway, CO, 81432
49.1044302, -122.80109400000003, familyPin, 3051, Baclig Vertical Garden, small_10x10, Edmonton, AB, 
48.817049, 2.5155560000000605, familyPin, 3052, Demeters Paradise, small_10x10, Evergreen, CO, 80439
48.817049, 2.5155560000000605, familyPin, 3053, Take 5 Tower Gardens, planter_box_etc, El Mirage, AZ, 85335
51.0543422, 3.717424299999948, familyPin, 3054, sustainable lifestyle strategies, large_over_20x20, Sidney, BC, 
54.574227, -1.234956000000011, familyPin, 3055, Jerrys City TG, small_10x10, Cottage Grove, MN, 55016
51.0543422, 3.717424299999948, familyPin, 3056, Crazy-Lady-Container-Garden, large_over_20x20, Hull, QC, 
54.574227, -1.234956000000011, familyPin, 3057, Larkey assoc., small_10x10, Denton, TX, 76209
-17.8251657, 31.03350999999998, communityPin, 3058, Corbin Intermediate School, planter_box_etc, Corbin, KY, 40701
-17.8251657, 31.03350999999998, familyPin, 3059, Scooby Organic Garden of Colorado, small_10x10, Aurora, CO, 80015
-17.8251657, 31.03350999999998, friendPin, 3060, Metamorphosis Gardens, planter_box_etc, Clarksville, TN, 37040
-17.8251657, 31.03350999999998, friendPin, 3061, Keyhole Amaazzing, medium_20x20, London, ON, N5Y 1
-17.8251657, 31.03350999999998, familyPin, 3062, Phillips Gardens, medium_20x20, Detroit, MI, 48238
54.574227, -1.234956000000011, familyPin, 3063, Relaxation Garden, large_over_20x20, Detoit, MI, 48082
-17.8251657, 31.03350999999998, familyPin, 3064, Whitehead Garden, small_10x10, Detroit, MI, 48204
-17.8251657, 31.03350999999998, familyPin, 3065, A garden of love, small_10x10, Detroit, MI, 48227
-17.863889, 31.029721999999992, familyPin, 3066, My Garden, small_10x10, Detroit, MI, 48238
-17.863889, 31.029721999999992, familyPin, 3067, USGC, large_over_20x20, Detroit, MI, 48219
-17.863889, 31.029721999999992, familyPin, 3068, Dream Weaver, small_10x10, Detroit, MI, 48221
-37.9029061, 144.65847469999994, friendPin, 3069, garden, small_10x10, Detroit, MI, 48204
47.91999999999999, 106.92000000000007, friendPin, 3070, Colemans, small_10x10, Detroit, MI, 48238
-37.9029061, 144.65847469999994, familyPin, 3071, 62nd street, small_10x10, Milwaukee, WI, 53222
42.459022, -83.09819, friendPin, 3072, Rebekahs Garden, small_10x10, Hazel Park, MI, 48030
42.395904, -82.99632, communityPin, 3073, OGD, large_over_20x20, Detroit, MI, 48213
47.91999999999999, 106.92000000000007, corporationPin, 3074, NAC, large_over_20x20, Detroit, MI, 48235
-37.9029061, 144.65847469999994, familyPin, 3075, New Dream Garden, medium_20x20, Linden, MI, 48451
37.794344, -79.47658, familyPin, 3076, WaterWitch  Garden and Grange, medium_20x20, Lexington, VA, 24450
44.062231, -123.16804, familyPin, 3077, Raggedy Hen Farm, large_over_20x20, Eugene, OR, 97402
47.91999999999999, 106.92000000000007, familyPin, 3078, Lisas Southfield Garden, medium_20x20, Southfield, MI, 48076
-37.9029061, 144.65847469999994, friendPin, 3079, HOMESTEAD DREAMER, medium_20x20, Annapolis, MD, 21409
47.91999999999999, 106.92000000000007, familyPin, 3080, HOMESTEAD DREAMER, medium_20x20, Annapolis, MD, 21409
-37.9029061, 144.65847469999994, friendPin, 3081, Larrys tomatoes, planter_box_etc, Southfield, MI, 48076
47.88639879999999, 106.90574390000006, familyPin, 3082, lisas garden, medium_20x20, Southfield, MI, 48076
-37.9029061, 144.65847469999994, familyPin, 3083, kebun pot, planter_box_etc, bekasi, ja, 
47.88639879999999, 106.90574390000006, familyPin, 3084, Forest Garden, medium_20x20, Keighley, We, BD21
-37.9029061, 144.65847469999994, familyPin, 3085, Nonni, large_over_20x20, Taibon agordino, Be, 
-37.9029061, 144.65847469999994, familyPin, 3086, The back 400sq ft., large_over_20x20, Richmond, CA, 94804
-37.9029061, 144.65847469999994, friendPin, 3087, Wilshire Homestead, large_over_20x20, Asheville, NC, 28806
-37.9029061, 144.65847469999994, friendPin, 3088, Humble Beginnings, small_10x10, Fort Wayne, IN, 46809
47.88639879999999, 106.90574390000006, familyPin, 3089, My Garden, medium_20x20, Yuba City, CA, 95993
-37.9029061, 144.65847469999994, friendPin, 3090, Elisabeths Garden, large_over_20x20, Marietta, GA, 30008
-37.9029061, 144.65847469999994, corporationPin, 3091, Main Street Farms, farm, Homer, NY, 13077
-37.9029061, 144.65847469999994, corporationPin, 3092, South Ave Urban Farm, farm, Cortland, NY, 13045
-37.9029061, 144.65847469999994, familyPin, 3093, The Sovereignty Garden, planter_box_etc, Windsor, ON, 
32.6245389, -115.45226230000003, familyPin, 3094, Towrivers Garden, medium_20x20, Vancouver, WA, 98661
32.6245389, -115.45226230000003, communityPin, 3095, Garden Station, farm, Dayton, OH, 45402
32.6245389, -115.45226230000003, communityPin, 3096, Moss Side Community Allotment, large_over_20x20, Manchester, M1, 
