Latitude,Longitude,Pin Type,id,Name,Size,City,Country,Zip/Postal Code
42.365337, -83.14254, friendPin, 2002, Garden of Hope, small_10x10, Detroit, MI, 48204
42.466086, -82.94641, familyPin, 2003, Chanitas Garden, medium_20x20, Eastpointe, MI, 48021
42.556943, -83.11506, friendPin, 2004, george, small_10x10, Troy, MI, 48083
42.727731, -83.03847, familyPin, 2005, diamondakaibo11@yahoo.com, large_over_20x20, washington, MI, 48094
42.432686, -83.04422, friendPin, 2006, Toms Garden, large_over_20x20, Detroit, MI, 48234
42.662902, -82.99392, familyPin, 2007, miller`s garden, small_10x10, shelby twp, MI, 48315
42.231788, -83.26481, familyPin, 2008, Robbins Family Garden, small_10x10, Taylor, MI, 48180
42.410487, -82.94348, friendPin, 2009, Jimmys, planter_box_etc, Detroit, MI, 48224
42.379436, -83.29105, familyPin, 2010, Browns, small_10x10, Redford, MI, 48239
42.379436, -83.29105, familyPin, 2011, Browns, small_10x10, Redford, MI, 48239
42.130091, -83.16017, friendPin, 2012, Tomato herb garden, small_10x10, Grosse Ile, MI, 48138
42.833034, -82.50425, familyPin, 2013, Jenks Garden, planter_box_etc, Saint Clair, MI, 48079
42.563505, -83.18405, familyPin, 2014, comfort zone, large_over_20x20, Troy, MI, 48084
42.466086, -82.94641, familyPin, 2015, Mommies PlayGarden, small_10x10, Eastpointe, MI, 48021
42.388786, -83.1918, familyPin, 2016, crystals&amp;#039, small_10x10, detroit, MI, 48227
42.467235, -83.17952, familyPin, 2017, Orains Orchard, small_10x10, Oak Park, MI, 48237
42.36837, -83.3527097, familyPin, 2018, rose garden, planter_box_etc, Livonia, MI, 48152
42.293787, -83.37464, familyPin, 2019, Athenas Garden, small_10x10, Westland, MI, 48186
42.250505, -83.14829, familyPin, 2020, Dawns Fresh Patch, medium_20x20, Ecorse, MI, 48229
42.338137, -83.12785, familyPin, 2021, my garden, planter_box_etc, Detroit, MI, 48210
42.368137, -82.99314, familyPin, 2022, grita, planter_box_etc, Detroit, MI, 48214
42.598734, -82.99938, familyPin, 2023, Campbells Corner, small_10x10, Sterling Heights, AL, 48313
42.465275, -83.2264, friendPin, 2024, My Childrens Garden, planter_box_etc, Southfield, MI, 48075
42.410037, -83.05826, familyPin, 2025, sharis urban patch, medium_20x20, Detroit, MI, 48212
42.365337, -83.14254, familyPin, 2026, WILLIAMS GARDEN, small_10x10, Det, MI, 48204
42.603172, -82.94459, familyPin, 2027, yonkoski gardens, medium_20x20, clinton twp, MI, 48038
42.205289, -83.19812, familyPin, 2028, Farmer Dougs, large_over_20x20, Southgate, MI, 48195
42.425236, -83.24902, familyPin, 2029, kysers, planter_box_etc, detroit, MI, 48219
42.338137, -83.12785, familyPin, 2030, Angies Garden, small_10x10, Detroit, MI, 48210
42.426285, -83.30197, friendPin, 2031, Robertson Garden, small_10x10, Redfrord, MI, 48240
42.639777, -83.04255, familyPin, 2032, Tricias treasures, large_over_20x20, Shelby Twp, MI, 48317
42.425236, -83.24902, familyPin, 2033, kysers, planter_box_etc, detroit, AL, 48219
42.689632, -83.06154, friendPin, 2034, Lindas garden, medium_20x20, Shelby Township, MI, 48316
42.829226, -82.77538, familyPin, 2035, rachels garden, large_over_20x20, Richmond, MI, 48062
42.410487, -82.94348, familyPin, 2036, Tiffany s, planter_box_etc, Detroit, MI, 48224
42.465886, -83.056, familyPin, 2037, Healthy and Fresh, small_10x10, Warren, MI, 48091
42.597323, -83.116567, familyPin, 2038, Frost Power, small_10x10, Troy, MI, 48085
42.467086, -82.99866, familyPin, 2039, Shirleys, planter_box_etc, warren, AL, 48089
42.488735, -83.13752, familyPin, 2040, ALEX, small_10x10, ROYAL OAK, MI, 48067
42.410487, -82.94348, familyPin, 2041, Tiffany s, planter_box_etc, Detroit, AL, 48224
42.243488, -83.18097, familyPin, 2042, jfalls2012@yahoo.com, medium_20x20, lincoln park, MI, 48146
42.410037, -83.05826, familyPin, 2043, Sharis Urban Patch, medium_20x20, Detroit, MI, 48212
42.678059, -83.915592, familyPin, 2044, Garden of HOPE, small_10x10, Howell, MI, 48855
42.425836, -82.90003, familyPin, 2045, Kaylees Korner, planter_box_etc, Grosse Pointe Farms, MI, 48236
42.410037, -83.05826, familyPin, 2046, Sharis Urban Patch, medium_20x20, Detroit, AL, 48212
42.212372, -83.37223, communityPin, 2047, a fresh place, large_over_20x20, Romulus, MI, 48174
42.566097, -83.75725, familyPin, 2048, Nerswick, planter_box_etc, Brighton, MI, 48114
42.467086, -82.99866, familyPin, 2049, family friendly, medium_20x20, warren, MI, 48089
42.421936, -83.09981, familyPin, 2050, Mable, small_10x10, Detroit, MI, 48203
42.4733688, -83.2218731, friendPin, 2051, Raised Bed, large_over_20x20, SOUTHFIELD, MI, 48033
42.467235, -83.17952, friendPin, 2052, herb, planter_box_etc, oak park, MI, 48237
42.320237, -83.26872, friendPin, 2053, Family Garden, small_10x10, Dearborn, MI, 48128
42.212372, -83.37223, communityPin, 2054, a fresh place, large_over_20x20, Romulus, AL, 48174
42.503285, -82.93851, familyPin, 2055, foster family, medium_20x20, Roseville, MI, 48066
42.503285, -82.93851, familyPin, 2056, my garden, small_10x10, Roseville, MI, 48066
42.355437, -83.21722, friendPin, 2057, Brendas Greens and Fruits, small_10x10, Detroit, MI, 48228
42.375237, -83.07837, friendPin, 2058, Green Goodies, planter_box_etc, Detroit, MI, 48202
42.388786, -83.1918, familyPin, 2059, kalas, small_10x10, detroit, MI, 48227
42.421936, -83.09981, familyPin, 2060, McPhersons Garden, medium_20x20, HIGHLAND PARK, MI, 48203
42.426786, -83.14969, familyPin, 2061, Shorts Garden, medium_20x20, Detroit, MI, 48221
42.331427, -83.0457538, familyPin, 2062, Belles, small_10x10, Detroit, MI, 48215
42.355437, -83.21722, familyPin, 2063, mattison, small_10x10, detroit, MI, 48228
42.1285378, -83.2827093, familyPin, 2064, Papas Place, medium_20x20, BROWNSTOWN, MI, 48193
32.6020793, -87.9311266, familyPin, 2065, Papas Place, medium_20x20, BROWNSTOWN, AL, 48193
42.642302, -83.35133, friendPin, 2066, gardening pots, planter_box_etc, waterford, MI, 48328
42.250505, -83.14829, familyPin, 2067, Family Garden, small_10x10, Ecorse, MI, 48229
42.514885, -82.99768, familyPin, 2068, Veggies, medium_20x20, Warren, MI, 48093
42.497736, -82.89979, familyPin, 2069, Chladas Garden, medium_20x20, Saint clair shores, MI, 48081
42.147222, -84.80789, familyPin, 2070, Robinsons Garden, medium_20x20, Homer, MI, 49245
42.355437, -83.21722, friendPin, 2071, geno, medium_20x20, det, MI, 48228
42.474234, -83.29078, familyPin, 2072, Knox farm, medium_20x20, Southfield, MI, 48034
42.394586, -83.24422, familyPin, 2073, Happy Growing, small_10x10, Detroit, MI, 48223
42.293787, -83.37464, familyPin, 2074, Febes Garden, medium_20x20, Westland, MI, 48186
42.462036, -82.90232, familyPin, 2075, The Gasiewski Garden, small_10x10, St. Clair Shores, MI, 48080
42.68347, -82.92958, familyPin, 2076, paradise, planter_box_etc, macomb twp, MI, 48042
42.68347, -82.92958, familyPin, 2077, paradise, planter_box_etc, macomb twp, AL, 48042
42.68347, -82.92958, familyPin, 2078, Home, small_10x10, Macomb, MI, 48042
42.662293, -83.12781, familyPin, 2079, Dinosaur Hill Nature Preserve, small_10x10, Rochester Hills, MI, 48307
42.247039, -83.58215, familyPin, 2080, Harris White House Garden, medium_20x20, Ypsilanti, MI, 48198
42.459022, -83.09819, familyPin, 2081, The Parker Farm, small_10x10, Hazel Park, MI, 48030
42.205289, -83.19812, familyPin, 2082, Toms garden, small_10x10, Southgate, MI, 48195
42.598734, -82.99938, familyPin, 2083, Orzmer, medium_20x20, Sterling Heights, MI, 48313
41.988228, -83.29818, familyPin, 2084, Garden in the farms, small_10x10, Newport, MI, 48166
42.639777, -83.04255, familyPin, 2085, dont die on me garden, small_10x10, shelby township mi, MI, 48317
42.596784, -82.88031, friendPin, 2086, Audies Greens, planter_box_etc, Mount Clemens, MN, 48043
42.978974, -82.44402, familyPin, 2087, gabbys garden, small_10x10, port huron, MI, 48060
42.466086, -82.94641, familyPin, 2088, Verne, medium_20x20, Eastpointe, MI, 48021
42.433703, -82.98068, friendPin, 2089, GAP Fellowship Community Garden, medium_20x20, Detroit, MI, 48205
42.670932, -82.77754, familyPin, 2090, Marys Garden, medium_20x20, Chesterfield, MI, 48047
42.769956, -82.52595, familyPin, 2091, Maridor Ranch, small_10x10, East China, MI, 48054
42.708151, -83.16584, friendPin, 2092, The Garden, large_over_20x20, rochester, MI, 48306
42.280887, -83.79147, familyPin, 2093, cowboys garden, planter_box_etc, ann arbor, MI, 48103
42.599133, -83.15235, familyPin, 2094, Kids Garden, medium_20x20, Troy, MI, 48098
42.826805, -83.02963, familyPin, 2095, My garden!, small_10x10, Bruce Township, MI, 48065
42.516851, -82.982757, familyPin, 2096, bettys garden, medium_20x20, Warren, MI, 48088
42.410487, -82.94348, friendPin, 2097, Healthy dining, medium_20x20, Detroit, MI, 48224
42.497736, -82.89979, friendPin, 2098, Bonnies LITTLE Acre, small_10x10, Saint Clair Shores, MI, 48081
42.462036, -82.90232, familyPin, 2099, Brdaks Plants, planter_box_etc, Saint Clair Shores, MI, 48080
42.499335, -83.22829, familyPin, 2100, norwood, small_10x10, southfield, MI, 48076
42.335937, -83.378, familyPin, 2101, Reynolds garden, planter_box_etc, Westland, MI, 48185
42.355437, -83.21722, familyPin, 2102, Kent family Garden, small_10x10, Detroit, MI, 48228
42.293787, -83.37464, familyPin, 2103, Gatesgarden, small_10x10, Westland, MI, 48186
42.425836, -82.90003, familyPin, 2104, Johnicas Garden, small_10x10, Detroit, MI, 48236
42.426786, -83.14969, friendPin, 2105, Babette, medium_20x20, Detroit, MI, 48221
42.128069, -83.38785, familyPin, 2106, Riopelles Garden, medium_20x20, New Boston, MI, 48164
42.501385, -83.10474, familyPin, 2107, Morrisons, small_10x10, Madison Heights, MI, 48071
42.388786, -83.1918, familyPin, 2108, Small Faith Garden, medium_20x20, Detroit, MI, 48227
42.465275, -83.2264, familyPin, 2109, Roberts s Garden, small_10x10, Southfield, MI, 48075
42.598734, -82.99938, familyPin, 2110, Gabria, medium_20x20, Sterling Heights, MI, 48313
42.460986, -83.13398, familyPin, 2111, The Crop Circle, medium_20x20, Ferndale, MI, 48220
42.231788, -83.26481, familyPin, 2112, Vetty vitty veggie plot, medium_20x20, Taylor, MI, 48180
42.355437, -83.21722, familyPin, 2113, The Good Food Place, small_10x10, Detroit, MI, 48228
42.388786, -83.1918, familyPin, 2114, Small Faith Garden, small_10x10, Detroit, MI, 48227
42.459022, -83.09819, familyPin, 2115, medleys bushes, medium_20x20, hazel park, MI, 48030
42.427636, -83.19547, familyPin, 2116, J & Ms  garden, small_10x10, Detroit, MI, 48235
42.479137, -83.02449, friendPin, 2117, Center Line Community Garden, large_over_20x20, Center Line, MI, 48015
42.410037, -83.05826, familyPin, 2118, shirleys best, small_10x10, detroit, MI, 48212
42.335687, -83.28332, friendPin, 2119, Rosetta, small_10x10, Dearborn Hts, MI, 48127
42.250505, -83.14829, familyPin, 2120, scooby doo, small_10x10, Ecorse, MI, 48229
42.425236, -83.24902, familyPin, 2121, Bills Garden, large_over_20x20, Detroit, MI, 48219
42.720966, -83.4044, familyPin, 2122, Qualls Corner, large_over_20x20, Clarkston, MI, 48346
42.438186, -82.9283, friendPin, 2123, JACs Grub, small_10x10, Harper Woods, MI, 48225
42.68347, -82.92958, familyPin, 2124, Freshdaily, medium_20x20, Macomb, MI, 48042
42.410037, -83.05826, communityPin, 2125, Hamtramck Library Community Garden, large_over_20x20, Hamtramck, MI, 48212
42.66415, -83.58982, familyPin, 2126, Doyle garden, medium_20x20, Highland, MI, 48356
42.511766, -83.47314, familyPin, 2127, Evans Garden, planter_box_etc, Novi, MI, 48377
42.582961, -82.83063, familyPin, 2128, Frank & Wendys Garden, small_10x10, Harrison Township, MI, 48045
42.459022, -83.09819, friendPin, 2129, Tinas Garden, planter_box_etc, Hazel Park, MI, 48030
42.467086, -82.99866, familyPin, 2130, Maxwell Group, small_10x10, Warren MI, MI, 48089
42.467945, -83.51766, familyPin, 2131, NATHANS GARDEN, small_10x10, NOVI, MI, 48374
42.662293, -83.12781, familyPin, 2132, Aufdi Garden, planter_box_etc, Rochester, MI, 48307
42.128069, -83.38785, familyPin, 2133, Golovich Homestead, medium_20x20, Huron Twp, MI, 48164
42.693915, -82.66859, familyPin, 2134, my garden, small_10x10, Ira, MI, 48023
42.280887, -83.79147, familyPin, 2135, Thomas Terrain, small_10x10, Ann Arbor, MI, 48103
42.467235, -83.17952, familyPin, 2136, Gails Garden, small_10x10, Oak Park, MI, 48237
42.277388, -83.25987, familyPin, 2137, jinan garden, medium_20x20, Dearborn Heights, MI, 48125
42.16489, -83.78387, familyPin, 2138, Scotchs Playground, small_10x10, Saline, MI, 48176
42.089891, -84.22768, familyPin, 2139, Zigs garden, medium_20x20, Brooklyn, MI, 49230
42.137071, -83.21446, familyPin, 2140, Seguinfamily Garden, medium_20x20, Woodhaven, MI, 48183
42.421936, -83.09981, communityPin, 2141, Mikes Memory Garden, large_over_20x20, Highland Park, MI, 48203
42.467086, -82.99866, familyPin, 2142, goodness, small_10x10, warren, MI, 48089
42.488735, -83.13752, familyPin, 2143, Here we grow again, large_over_20x20, Royal Oak, MI, 48067
42.526965, -82.88809, familyPin, 2144, Neals Meals, small_10x10, saint clair shores, MI, 48082
42.231788, -83.26481, familyPin, 2145, Ava, medium_20x20, Taylor, MI, 48180
42.465275, -83.2264, familyPin, 2146, My Childrens Garden, planter_box_etc, Southfield, MI, 48075
41.881632, -71.35583, familyPin, 2147, Finlays Royal garden, medium_20x20, Pawtucket, RI, 02861
42.328338, -83.07805, familyPin, 2148, Buentello Jr Garden, medium_20x20, Detroit, MI, 48216
42.465886, -83.056, familyPin, 2149, KRISSYS, medium_20x20, WARREN, MI, 48091
42.45644, -83.66673, familyPin, 2150, Baby food, small_10x10, south lyon, MI, 48178
42.511766, -83.47314, familyPin, 2151, North Haven Feast Beast, medium_20x20, Novi, MI, 48377
42.455063, -83.93425, familyPin, 2152, Spallers Spuds, small_10x10, Pinckney, MI, 48169
42.247039, -83.58215, familyPin, 2153, Raised Beds, small_10x10, Ypsilanti, MI, 48198
42.823968, -83.27921, familyPin, 2154, Niereschers, medium_20x20, Oxford, MI, 48371
41.940898, -83.38515, friendPin, 2155, Larrys Place, small_10x10, Monroe, MI, 48162
42.289354, -83.47401, friendPin, 2156, Ashlyn Hope, small_10x10, Canton, MI, 48188
42.426285, -83.30197, familyPin, 2157, Clan Douglas, small_10x10, Redford, MI, 48240
42.566097, -83.75725, familyPin, 2158, Garden, small_10x10, Brighton, MI, 48114
42.466086, -82.94641, familyPin, 2159, P&Cs Garden, medium_20x20, eastpointe, MI, 48021
42.33087, -83.47575, familyPin, 2160, Jims Garden, small_10x10, Canton, MI, 48187
42.223482, -83.63316, familyPin, 2161, terry and tom, medium_20x20, ypsilanti, MI, 48197
41.965806, -83.67133, familyPin, 2162, Kuzala farm, large_over_20x20, Dundee, MI, 48131
42.612243, -83.91835, familyPin, 2163, Suchland garden, planter_box_etc, Howell, MI, 48843
42.231788, -83.26481, familyPin, 2164, Red Garden Gate, medium_20x20, tayloe, MI, 48180
42.355437, -83.21722, friendPin, 2165, My Garden, small_10x10, Detroit, MI, 48228
42.466086, -82.94641, familyPin, 2166, Divine Fruits and Veggies, small_10x10, Eastpointe, MI, 48021
42.355437, -83.21722, friendPin, 2167, Urban Patch, medium_20x20, Detroit, MI, 48228
42.262135, -84.41052, friendPin, 2168, Connects Garden, small_10x10, Jackson, MI, 49202
42.426786, -83.14969, familyPin, 2169, Dixons Family Garden, small_10x10, Detroit, MI, 48221
42.239933, -83.150823, familyPin, 2170, Amanda Williams, planter_box_etc, Dearborn, MI, 48121
42.467086, -82.99866, familyPin, 2171, Warthen, planter_box_etc, Warren, MI, 48089
42.243488, -83.18097, familyPin, 2172, Suzis comunity Garden, medium_20x20, Lincoln park, MI, 48146
42.503285, -82.93851, friendPin, 2173, Garden, large_over_20x20, Shelby Twp, MI, 48066
42.563644, -83.07158, friendPin, 2174, Alana, small_10x10, Sterling Heights, MI, 48310
42.231788, -83.26481, familyPin, 2175, Grow Dam It, medium_20x20, taylor, MI, 48180
42.499335, -83.22829, friendPin, 2176, serenity, small_10x10, southfield, mi, 48076
42.462036, -82.90232, familyPin, 2177, KIMMIES GARDEN, planter_box_etc, SAINT CLAIR SHORES, MI, 48080
42.343787, -83.05879, familyPin, 2178, Fleur, small_10x10, Detroit, MI, 48201
42.16489, -83.78387, familyPin, 2179, Saline Community Garden, small_10x10, Saline, MI, 48176
42.536402, -82.95044, friendPin, 2180, Therapy, medium_20x20, fraser, MI, 48026
42.212372, -83.37223, familyPin, 2181, home is where the food is, medium_20x20, romulus, MI, 48174
42.427636, -83.19547, familyPin, 2182, Lenas Garden, small_10x10, Detroit, MI, 48235
42.682081, -82.83068, familyPin, 2183, Cassies and Mom Garden, small_10x10, Chesterfield, MI, 48051
42.516851, -82.982757, familyPin, 2184, Family Garden, small_10x10, Warren, MI, 48088
42.426786, -83.14969, familyPin, 2185, Boykin Garden Oasis, small_10x10, Detroit, MI, 48221
42.467945, -83.51766, familyPin, 2186, Hobbiton, medium_20x20, Novi, MI, 48374
43.985129, -83.93628, familyPin, 2187, Hoops Coop & Garden, large_over_20x20, Standish, MI, 48658
42.231788, -83.26481, friendPin, 2188, Loomis Garden, small_10x10, Taylor, MI, 48180
42.462036, -82.90232, familyPin, 2189, grams garden, small_10x10, st clair shores, MI, 48080
42.331427, -83.0457538, familyPin, 2190, DaLyGrow, small_10x10, Detroit, MI, 48234
42.662293, -83.12781, familyPin, 2191, The Ekstroms Backyard Garden, small_10x10, Rochester Hill, MI, 48307
42.425236, -83.24902, familyPin, 2192, Spiritual Truth, small_10x10, Detroit, MI, 48219
42.501385, -83.10474, familyPin, 2193, Tatijaykai3, small_10x10, Madison heights, MI, 48071
42.479137, -83.02449, friendPin, 2194, Porters Paradise, small_10x10, Center line, MI, 48015
42.247039, -83.58215, familyPin, 2195, JD Gardens, small_10x10, Ypsilanti, MI, 48198
42.829226, -82.77538, familyPin, 2196, Mckenzies garden, large_over_20x20, richmond, MI, 48062
42.194865, -83.49083, familyPin, 2197, Cunningham garden, medium_20x20, Belleville, MI, 48111
42.668532, -83.29585, familyPin, 2198, Krazy Kreiner Farm, medium_20x20, Pontiac, MI, 48340
42.650265, -82.93416, familyPin, 2199, veggies grow, medium_20x20, Macomb, MI, 48044
42.460986, -83.13398, friendPin, 2200, Jacks Garden Hideout, small_10x10, Ferndale, MI, 48220
42.247039, -83.58215, familyPin, 2201, Bunnies Bless, medium_20x20, Ypsilanti, MI, 48198
42.375237, -83.07837, familyPin, 2202, Shadows Garden, medium_20x20, detroit, MI, 48202
42.107026, -83.28711, familyPin, 2203, Mariah and Mommys Veggie Garden, small_10x10, Flat Rock, MI, 48134
42.642431, -83.47193, familyPin, 2204, D & J Lake Garden, medium_20x20, White Lake, MI, 48386
42.396194, -83.37161, familyPin, 2205, Feeding the family veggies, small_10x10, Livonia, MI, 48154
42.558151, -83.00446, friendPin, 2206, Marjories garden, small_10x10, Sterling Heights, MI, 48312
42.535534, -83.15112, familyPin, 2207, Grown by Phil, medium_20x20, Clawson, MI, 48017
42.333787, -83.18179, familyPin, 2208, Tabitha Ali-Rock, small_10x10, dearborn, MI, 48126
42.194865, -83.49083, familyPin, 2209, Michaels Place, large_over_20x20, Sumpter Township, MI, 48111
42.243488, -83.18097, familyPin, 2210, My Porch Garden, planter_box_etc, Lincoln Park, MI, 48146
42.243488, -83.18097, familyPin, 2211, Wrights garden, small_10x10, Lincoln Park, MI, 48146
42.66415, -83.58982, familyPin, 2212, Laura Loos, medium_20x20, Highland, MI, 48356
42.394586, -83.24422, familyPin, 2213, Puffins Place, medium_20x20, Detroit, MI, 48223
42.467086, -82.99866, familyPin, 2214, Bevs Botanical, small_10x10, Warren, MI, 48089
42.768373, -83.37805, familyPin, 2215, Beth Smith, large_over_20x20, Clarkston, MI, 48348
42.396736, -83.14152, friendPin, 2216, marvs mARVEL, medium_20x20, DETROIT, MI, 48238
42.45644, -83.66673, familyPin, 2217, shells garden, small_10x10, South Lyon, MI, 48178
42.722932, -83.28537, familyPin, 2218, Jesscas Garden, planter_box_etc, Orion, MI, 48359
42.596784, -82.88031, familyPin, 2219, Ol McDonald, small_10x10, Mount Clemens, MI, 48043
42.467235, -83.17952, friendPin, 2220, greenberg garden, planter_box_etc, Oak Park, MI, 48237
42.467235, -83.17952, familyPin, 2221, Savannahs House, planter_box_etc, Oak Park, MI, 48237
42.243488, -83.18097, familyPin, 2222, Karas Corner, medium_20x20, Lincoln Park, MI, 48146
42.394586, -83.24422, friendPin, 2223, brooks garden of light, medium_20x20, detroit, MI, 48223
42.558151, -83.00446, familyPin, 2224, Veggies, small_10x10, Sterling heights, MI, 48312
43.116959, -83.69025, communityPin, 2225, Carriage Town Ministry Childrens garden and Denny Nichols Memorial Garden at Carriage Town, large_over_20x20, Flint, MI, 48458
42.277388, -83.25987, familyPin, 2226, Vetetos Veggies, small_10x10, Dearborn Heights, MI, 48125
42.78459, -83.74074, familyPin, 2227, Norah and Rennies garden, medium_20x20, Fenton, MI, 48430
42.254788, -83.21027, familyPin, 2228, Grays, medium_20x20, Allen Park, MI, 48101
42.289354, -83.47401, friendPin, 2229, Home garden, small_10x10, Canton, AL, 48188
42.642302, -83.35133, friendPin, 2230, Luscious Lakeside, small_10x10, Waterford, MI, 48328
42.231788, -83.26481, friendPin, 2231, Alicias Garden, medium_20x20, Taylor, MI, 48180
42.459022, -83.09819, friendPin, 2232, Mikes and Jens Garden, small_10x10, Hazel Park, MI, 48030
42.455063, -83.93425, familyPin, 2233, mamalew82, medium_20x20, pinckney, MI, 48169
42.421936, -83.09981, familyPin, 2234, Miracle Hands, medium_20x20, Detroit, MI, 48203
42.427636, -83.19547, familyPin, 2235, Granny Jewels love, small_10x10, Detroit, MI, 48235
42.396194, -83.37161, familyPin, 2236, Claires Garden, small_10x10, livonia, AL, 48154
42.352837, -83.02449, familyPin, 2237, beyond baskets, small_10x10, detroit, MI, 48207
42.128069, -83.38785, familyPin, 2238, Cruz Gardens, planter_box_etc, New Boston, MI, 48164
42.426786, -83.14969, familyPin, 2239, Hardy Bunch, small_10x10, Detroit, MI, 48221
42.536402, -82.95044, familyPin, 2240, Marissas garden, small_10x10, Fraser, MI, 48026
42.509476, -83.77718, familyPin, 2241, Loris Garden, large_over_20x20, Brighton, MI, 48116
42.514885, -82.99768, familyPin, 2242, veggie land, medium_20x20, warre, MI, 48093
42.426786, -83.14969, communityPin, 2243, Mz.Haze Heavenly Harvest, large_over_20x20, Detroit, MI, 48221
42.223482, -83.63316, familyPin, 2244, Our Porch Produce, planter_box_etc, Ypsilanti, MI, 48197
42.231788, -83.26481, friendPin, 2245, My Garden, small_10x10, Taylor, MI, 48180
42.388786, -83.1918, friendPin, 2246, Minkyluv Food of love, small_10x10, Detroit, MI, 48227
40.103791, -79.59396, familyPin, 2247, Tremaines Green thumb, small_10x10, Scottdale, PA, 15683
42.563644, -83.07158, familyPin, 2248, Butterfly, small_10x10, Sterling Heights, MI, 48310
42.514885, -82.99768, familyPin, 2249, the bomb, small_10x10, warren, MI, 48093
42.335937, -83.378, familyPin, 2250, Arlitt, small_10x10, Westland, MI, 48185
42.497736, -82.89979, familyPin, 2251, garys garden, small_10x10, Saint clair shores, MI, 48081
42.467235, -83.17952, familyPin, 2252, Mac Family Farm, medium_20x20, Oak Park, MI, 48237
42.826805, -83.02963, familyPin, 2253, Home Garden, small_10x10, Romeo, MI, 48065
42.644709, -83.71792, friendPin, 2254, Evas Eden, planter_box_etc, Hartland, MI, 48353
42.324338, -83.3382, familyPin, 2255, Garden of 5, planter_box_etc, Garden City, MI, 48135
42.826805, -83.02963, familyPin, 2256, Home Garden, small_10x10, Romeo, MI, 48065
42.536402, -82.95044, familyPin, 2257, Grow so I can eat You, medium_20x20, Fraser, MI, 48026
42.331427, -83.0457538, familyPin, 2258, Jay & Joshs Love Garden, planter_box_etc, Detroit, MI, 49210
42.768373, -83.37805, corporationPin, 2259, Feed The D Step 1, large_over_20x20, Clarkston, MI, 48348
42.768373, -83.37805, familyPin, 2260, Marlenes Garden, large_over_20x20, Clarkston, MI, 48348
42.331427, -83.0457538, familyPin, 2261, Timothys Garden, small_10x10, Detroit, MI, 48200
42.459022, -83.09819, familyPin, 2262, cs garden, medium_20x20, hazelpark, MI, 48030
42.375787, -83.10849, familyPin, 2263, Bobbys Garden, small_10x10, Detroit, AL, 48206
42.488735, -83.13752, familyPin, 2264, Scherbarthian, small_10x10, royal oak, MI, 48067
42.348937, -83.08994, familyPin, 2265, Cooper, small_10x10, Detroit, MI, 48208
42.212372, -83.37223, familyPin, 2266, murry fam, planter_box_etc, romulus, MI, 48174
42.352837, -83.02449, communityPin, 2267, Prince Hall Place Community Garden, medium_20x20, Detroit, MI, 48207
42.231788, -83.26481, familyPin, 2268, My home garden, small_10x10, Taylor, MI, 48180
42.212372, -83.37223, familyPin, 2269, murry fam, planter_box_etc, romulus, AL, 48174
36.213004, -86.72594, friendPin, 2270, Miss Elviras garden, large_over_20x20, Nashville, TN, 37216
42.212372, -83.37223, familyPin, 2271, murry, planter_box_etc, fam, MI, 48174
42.212372, -83.37223, familyPin, 2272, mya31580@gmail.com, planter_box_etc, romulus, MI, 48174
42.599133, -83.15235, friendPin, 2273, Alfa, small_10x10, Troy, MI, 48098
42.501385, -83.10474, familyPin, 2274, juhasz, medium_20x20, Madison Heights, MI, 48071
42.425236, -83.24902, friendPin, 2275, Williams Garden, medium_20x20, Detroit, AL, 48219
42.375787, -83.10849, familyPin, 2276, Fresh Veg, small_10x10, detroit, MI, 48206
41.885451, -83.418524, familyPin, 2277, Three Js, medium_20x20, Manchester, MI, 48168
42.587117, -82.89837, familyPin, 2278, Cheryls Garden, small_10x10, Clinton Township, MI, 48036
42.518635, -83.16357, familyPin, 2279, Little Sicily, medium_20x20, royal oak, MI, 48073
42.587117, -82.89837, friendPin, 2280, Mittelstedt family garden, medium_20x20, Clinton township, MI, 48036
42.410037, -83.05826, familyPin, 2281, ogrodek Patryka, small_10x10, Hamtramck, MI, 48212
42.293787, -83.37464, friendPin, 2282, Dream and your Journey, small_10x10, Westland, MI, 48186
42.223482, -83.63316, familyPin, 2283, The Survival Garden, medium_20x20, Ypsilanti, MI, 48197
42.293787, -83.37464, friendPin, 2284, Dream and Journey, small_10x10, Westland, MI, 48186
42.536402, -82.95044, familyPin, 2285, Hurt, large_over_20x20, Detroit, MI, 48026
